{
  "profile_version": "0.1",
  "receipt_id": "26c16478-babf-4d5a-9492-67223223be13",
  "issued_at": "2026-07-27T17:37:06.150799Z",
  "request": {
    "profile_version": "0.1",
    "request_id": "280a2503-87f8-4c16-90f8-4528870cc19d",
    "issued_at": "2026-07-27T17:37:06.146710Z",
    "agent_identity": "spiffe://demo.example/agent/remediator",
    "capability_id": "credentials.rotate",
    "requested_action": "rotate production credential",
    "resource_scope": {
      "vault": "production"
    },
    "risk_level": "critical",
    "tenant": "public-demo",
    "environment": "controlled",
    "payload_hash": "sha256:1cb6101acd762f1b5ba42303e461f98eb6df135d0dafb431dd43b60c40c118f0",
    "authority_chain": [
      "demo-delegation-v1"
    ],
    "idempotency_key": "5c22715b-365e-4013-be09-c607aba2212f"
  },
  "authority": {
    "status": "VALID",
    "subject": "spiffe://demo.example/agent/remediator",
    "capabilities": [
      "repository.inspect",
      "repository.merge.production",
      "repository.patch.propose"
    ]
  },
  "policy": {
    "policy_id": "demo.secure-coding",
    "policy_version": "1",
    "status": "EVALUATED"
  },
  "decision": "DENY",
  "execution": {
    "authorized": false,
    "attempted": false,
    "status": "NOT_ATTEMPTED"
  },
  "evidence_hashes": [
    "sha256:c31a3e40fb1c3d960b17360e9b835e7ab0949bdb744a4265a14c743aa9a67bd1"
  ],
  "previous_record_hash": "sha256:2f25afaa64aa752a128bee22a2d4aa72cd184f5dd68913b163a8a36f9809b8aa",
  "record_hash": "sha256:bb83f3cdca52067326b4243b46f64bbb4a4f8413711df085db0ec03cc1bd71cc",
  "signature": {
    "algorithm": "Ed25519",
    "key_id": "demo-ed25519-2026-01",
    "value": "0BBfTNqmeN4foAgJDa4S6P95Xjvurw16jsi36DIH7LTXvJiUrzkmfKq_5LBTRJSrKrhhKRKo3KmERkk7Of7jDQ"
  }
}
